status_id,status_message,link_name,status_type,status_link,status_published,num_reactions,num_comments,num_shares,num_likes,num_loves,num_wows,num_hahas,num_sads,num_angrys
210623000268_10153197494735269,"Come on, everybody! Let's have a ball. The king of rap performs live. Book your tickets here: http://bit.ly/jd-badshah",Timeline Photos,photo,https://www.facebook.com/JustDial/photos/a.218451745268.178591.210623000268/10153197494735269/?type=3,2015-04-29 05:11:54,60,1,2,60,0,0,0,0,0
210623000268_10153195779990269,A summer weekend on a beach resort can be very relaxing. So plan this weekend getaway with Just dial. Visit bit.ly/JD-trip and look for beach resort near your city.,Photos from Just Dial's post,photo,https://www.facebook.com/JustDial/photos/a.218451745268.178591.210623000268/10153195779190269/?type=3,2015-04-28 10:18:47,652,14,14,652,0,0,0,0,0
210623000268_10153193136140269,"Too reliant on David – Dhawan? Who else do you think should take charge in the middle order?
Image Credit: https://twitter.com/SunRisers/status/591967589766602752",Timeline Photos,photo,https://www.facebook.com/JustDial/photos/a.218451745268.178591.210623000268/10153193136140269/?type=3,2015-04-27 08:28:31,71,7,5,71,0,0,0,0,0
210623000268_10153192913620269,"#Badshaah, the voice behind ""abhi toh party shuru hui hai"" live in your city. Book your tickets here: http://bit.ly/jd-badshah",Timeline Photos,photo,https://www.facebook.com/JustDial/photos/a.218451745268.178591.210623000268/10153192913620269/?type=3,2015-04-27 05:44:57,49,3,6,49,0,0,0,0,0
210623000268_10153185858470269,"They've broken the Home Loss Jinx!
Join us in cheering for Delhi Daredevils while they play against #RCB 
tonight at 8 PM.
Image Credit - https://instagram.com/p/1r0LmVD3r5/",Timeline Photos,photo,https://www.facebook.com/JustDial/photos/a.218451745268.178591.210623000268/10153185858470269/?type=3,2015-04-26 07:05:01,140,4,3,140,0,0,0,0,0
210623000268_10153185835315269,#SRH has been shuffling their playing XI a lot recently. Which combination do you prefer?,Timeline Photos,photo,https://www.facebook.com/JustDial/photos/a.218451745268.178591.210623000268/10153185835315269/?type=3,2015-04-25 01:30:01,117,11,2,117,0,0,0,0,0
210623000268_10153185822305269,"Are you heading to GOA for the long weekend?
A visit to Titos is a MUST! Enjoy an evening with 8 hours of non-stop EDM at one of the most HAPPENING places in GOA!
Book you tickets now: http://bit.ly/jd-summer",Timeline Photos,photo,https://www.facebook.com/JustDial/photos/a.218451745268.178591.210623000268/10153185820505269/?type=3,2015-04-24 08:00:21,49,5,6,49,0,0,0,0,0
210623000268_10153183872045269,"Delhi Daredevils bat first. Good luck out there guys.Looking forward to a great game today. #DDvMI

Image Credit - https://instagram.com/p/1ryRMfD3qJ/",Timeline Photos,photo,https://www.facebook.com/JustDial/photos/a.218451745268.178591.210623000268/10153183871590269/?type=3,2015-04-23 09:39:34,125,7,3,125,0,0,0,0,0
210623000268_10153183768815269,"Books wash away from the soul, the dust of everyday life! 
So on #WorldBookDay visit http://bit.ly/JD-books & order books online.",Timeline Photos,photo,https://www.facebook.com/JustDial/photos/a.218451745268.178591.210623000268/10153183768390269/?type=3,2015-04-23 08:38:58,58,7,5,58,0,0,0,0,0
210623000268_10153183237045269,"GET INSPIRED from the people who made the difference! Watch Shailendra Singh (Inceptor - Sunburn Festival, Author & Joint MD Percept Ltd) , Ram Subramanian (Film Maker, Writer, Founder & Director Handloom Picture Company), Ashwin Sanghi (Best Selling Indian Author & Entrepreneur) and many more eminent speakers share their thoughts about the most pressing global issues at the Mumbai Youth Speak Forum
Book your passes now @ http://bit.ly/jd-yforum
Cash on delivery option available!",Timeline Photos,photo,https://www.facebook.com/JustDial/photos/a.218451745268.178591.210623000268/10153183204235269/?type=3,2015-04-23 02:58:59,49,6,4,49,0,0,0,0,0
210623000268_10153181382275269,"If you're ready to grow, get on a smart path with just dial",Timeline Photos,photo,https://www.facebook.com/JustDial/photos/a.218451745268.178591.210623000268/10153181381465269/?type=3,2015-04-22 09:07:28,198,9,13,198,0,0,0,0,0
210623000268_10153180886415269,"Move beyond boring parties, witness the craziness of electronic dance music. Book you tickets now: http://bit.ly/jd-summer",Timeline Photos,photo,https://www.facebook.com/JustDial/photos/a.218451745268.178591.210623000268/10153180885995269/?type=3,2015-04-22 02:11:24,56,5,4,56,0,0,0,0,0
210623000268_10153179165365269,Let your voice be heard.Book your passes here for mumbai youth speak forum now: http://bit.ly/MumYouthSpeakForum,Timeline Photos,photo,https://www.facebook.com/JustDial/photos/a.218451745268.178591.210623000268/10153179044450269/?type=3,2015-04-21 10:30:01,48,1,1,48,0,0,0,0,0
210623000268_10153179006565269,"Why use multiple apps when you can have just one? Yes, the latest version of JD Android App provides you with all you need. You can shop, pay your bills, select the restaurants according to your mood, claim exciting deals and offers & lots more. Download now @ jsdl.in/adl and enjoy all benefits in one app.",Timeline Photos,photo,https://www.facebook.com/JustDial/photos/a.218451745268.178591.210623000268/10153179006075269/?type=3,2015-04-21 08:56:06,79,1,13,79,0,0,0,0,0
210623000268_10153176824650269,Is #DelhiDareDevil going score a hattrick today by winning the match? #DDVsKKR,Timeline Photos,photo,https://www.facebook.com/JustDial/photos/a.218451745268.178591.210623000268/10153176740665269/?type=3,2015-04-20 09:18:01,544,103,7,544,0,0,0,0,0
210623000268_10153173640365269,"Gear up for the gig like no other. Witness the King of comedy, Kapil Sharma live in your city. Book your tickets here http://bit.ly/jd-kapil-evng",Timeline Photos,photo,https://www.facebook.com/JustDial/photos/a.218451745268.178591.210623000268/10153169587245269/?type=3,2015-04-19 00:03:01,197,6,7,197,0,0,0,0,0
210623000268_10153171775845269,Can you guess the team?,Timeline Photos,photo,https://www.facebook.com/JustDial/photos/a.218451745268.178591.210623000268/10153169532590269/?type=3,2015-04-18 05:30:00,158,34,4,158,0,0,0,0,0
210623000268_10153171181255269,"Not just a Search Engine, it's a one stop solution to search & transact. From booking doctor's appointment to shopping online, anything to you need, Justdial :)",Just Dial's cover photo,photo,https://www.facebook.com/JustDial/photos/a.10150765605555269.469341.210623000268/10153171180915269/?type=3,2015-04-18 00:57:48,99,4,17,99,0,0,0,0,0
210623000268_10153167313465269,#SRH playing their 1st home game today. It's time that Vizag goes Orange! #OrangeArmy #SRH,Timeline Photos,photo,https://www.facebook.com/JustDial/photos/a.218451745268.178591.210623000268/10153167312820269/?type=3,2015-04-16 09:19:42,123,3,4,123,0,0,0,0,0
210623000268_10153167171610269,Let's grow your business together.,Timeline Photos,photo,https://www.facebook.com/JustDial/photos/a.218451745268.178591.210623000268/10153167165505269/?type=3,2015-04-16 07:48:27,231,12,20,231,0,0,0,0,0
210623000268_10153165257605269,"1st Game was Close, 2nd was closer. This time we are up & are raring to go over the line. Let's get back to winning ways!",Timeline Photos,photo,https://www.facebook.com/JustDial/photos/a.218451745268.178591.210623000268/10153165257455269/?type=3,2015-04-15 09:47:07,223,7,20,223,0,0,0,0,0
210623000268_10153165250815269,,Just Dial's cover photo,photo,https://www.facebook.com/JustDial/photos/a.10150765605555269.469341.210623000268/10153165250520269/?type=3,2015-04-15 09:44:20,102,0,3,102,0,0,0,0,0
210623000268_10153164563025269,"In this season of cricket, how about ordering cricket themed cakes? Visit www.justdial.com and look for cake shops now.",Photos from Just Dial's post,photo,https://www.facebook.com/JustDial/photos/a.218451745268.178591.210623000268/10153164561925269/?type=3,2015-04-15 01:09:44,536,9,43,536,0,0,0,0,0
210623000268_10153160664435269,Cheer for the #OrangeArmy! #SRHVsRCB  has kick-started.,Timeline Photos,photo,https://www.facebook.com/JustDial/photos/a.218451745268.178591.210623000268/10153160664105269/?type=3,2015-04-13 09:36:23,241,2,5,241,0,0,0,0,0
210623000268_10153153573510269,"So what we had a bad start, victory is not very far. Join us to cheer up Delhi Daredevils today at 4.00 PM against #RajashtanRoyals.",,status,,2015-04-12 05:00:01,121,4,2,121,0,0,0,0,0
210623000268_10153153266000269,Gift these majestic vase to your friend on her birthday. Visit www.justdial.com and look for gift shops now.,Photos from Just Dial's post,photo,https://www.facebook.com/JustDial/photos/a.218451745268.178591.210623000268/10153153265175269/?type=3,2015-04-11 00:41:00,734,9,30,734,0,0,0,0,0
210623000268_10153153509610269,"Do you agree to it?

#HappyWeekend",Timeline Photos,photo,https://www.facebook.com/JustDial/photos/a.218451745268.178591.210623000268/10153153508790269/?type=3,2015-04-10 08:07:41,147,2,11,147,0,0,0,0,0
210623000268_10153151342425269,Thumbs Up if you are a Delhi Daredevils fan.,Just Dial's cover photo,photo,https://www.facebook.com/JustDial/photos/a.10150765605555269.469341.210623000268/10153151342085269/?type=3,2015-04-09 09:09:57,167,6,10,167,0,0,0,0,0
210623000268_10153149276155269,#IndiaKaTyohaarBegins aur pehla match family ke saath dekhna banta hai! Order food online from www.justdial.com & enjoy the game. #IPL2015 #KKRvMI,Timeline Photos,photo,https://www.facebook.com/JustDial/photos/a.218451745268.178591.210623000268/10153149218570269/?type=3,2015-04-08 09:15:00,795,4,15,795,0,0,0,0,0
210623000268_10153147021465269,It's #WorldHealthDay. Celebrate it with a routine checkup. Visit www.justdial.com to locate a thyrocare clinic near you and schedule a test.,Timeline Photos,photo,https://www.facebook.com/JustDial/photos/a.218451745268.178591.210623000268/10153147018815269/?type=3,2015-04-07 08:13:32,152,13,5,152,0,0,0,0,0
210623000268_10153132623780269,"How about going to a water park, this summer? Visit www.justdial.com  and look for water parks near you.",Photos from Just Dial's post,photo,https://www.facebook.com/JustDial/photos/a.218451745268.178591.210623000268/10153132623310269/?type=3,2015-04-05 00:45:00,674,12,16,674,0,0,0,0,0
210623000268_10153135242885269,Save a life. Adopt a pet. Visit www.justdial.com and look for pet stores near you.,Photos from Just Dial's post,photo,https://www.facebook.com/JustDial/photos/a.218451745268.178591.210623000268/10153135242155269/?type=3,2015-04-04 00:30:00,4502,76,257,4502,0,0,0,0,0
210623000268_10153135322540269,Where would you wish to have your dinner tonight? Visit www.justdial.com and look for theme based restaurant near you.,Photos from Just Dial's post,photo,https://www.facebook.com/JustDial/photos/a.218451745268.178591.210623000268/10153135321750269/?type=3,2015-04-03 01:00:00,344,4,11,344,0,0,0,0,0
210623000268_10153132615370269,If the hunger is getting unbearable then visit www.justdial.com and order food online from the nearest snack bar.,Timeline Photos,photo,https://www.facebook.com/JustDial/photos/a.218451745268.178591.210623000268/10153132613690269/?type=3,2015-04-01 00:33:30,458,5,5,458,0,0,0,0,0
210623000268_10153130643975269,Which clock would you select for your kitchen?,Photos from Just Dial's post,photo,https://www.facebook.com/JustDial/photos/a.218451745268.178591.210623000268/10153130642665269/?type=3,2015-03-31 01:00:01,944,13,55,944,0,0,0,0,0
210623000268_10153127909030269,Long weekend is approaching!! Plan a weekend getaway with Justdial. Visit www.justdial.com and look for travel agents now.,Photos from Just Dial's post,photo,https://www.facebook.com/JustDial/photos/a.218451745268.178591.210623000268/10153127908290269/?type=3,2015-03-30 05:30:00,574,4,50,574,0,0,0,0,0
210623000268_10153120591870269,Paper quilling can be an interesting art to learn. Visit www.justdial.com and look for hobby classes now.,Photos from Just Dial's post,photo,https://www.facebook.com/JustDial/photos/a.218451745268.178591.210623000268/10153120591495269/?type=3,2015-03-29 00:30:00,2727,41,263,2727,0,0,0,0,0
210623000268_10153122578985269,Don't miss your chance to witness Arijit Singh live in your city. Book your tickets now @ http://bit.ly/Arijit_mbai,Timeline Photos,photo,https://www.facebook.com/JustDial/photos/a.218451745268.178591.210623000268/10153120833770269/?type=3,2015-03-27 23:50:01,328,7,11,328,0,0,0,0,0
210623000268_10153118806915269,"Have you ever partied in a historical movie theater??? On March 28th Lucid Asia is breaking all the boundaries with ""Hard Days""! A seven hours Bass Music festival at Liberty Cinemas headlined by Bare Noize, Bar 9 and Etnik.
Book your tickets NOW on Justdial Entertainment @ http://bit.ly/JD-HardDays",Timeline Photos,photo,https://www.facebook.com/JustDial/photos/a.218451745268.178591.210623000268/10153118806760269/?type=3,2015-03-26 09:36:44,81,2,1,81,0,0,0,0,0
210623000268_10153118113020269,"The voice behind some of the most popular songs, 
Arijit Singh Official is performing live and you can't miss it, Can you? So click here & book your tickets here: http://bit.ly/Arijit_mbai",Timeline Photos,photo,https://www.facebook.com/JustDial/photos/a.218451745268.178591.210623000268/10153116400990269/?type=3,2015-03-26 00:00:01,182,2,4,182,0,0,0,0,0
210623000268_10153104585860269,"How about driving cars like these?
Log on to www.justdial.com to book a test drive in your dream car!",Photos from Just Dial's post,photo,https://www.facebook.com/JustDial/photos/a.218451745268.178591.210623000268/10153104584915269/?type=3,2015-03-23 00:10:00,243,10,13,243,0,0,0,0,0
210623000268_10153108469990269,Don't miss your chance to witness Arijit Singh live in #Mumbai. Book your tickets now @ http://bit.ly/Arijit_mbai,Timeline Photos,photo,https://www.facebook.com/JustDial/photos/a.218451745268.178591.210623000268/10153104536640269/?type=3,2015-03-21 23:50:00,345,5,8,345,0,0,0,0,0
210623000268_10153104307960269,Give a memorable invite to everyone. Visit www.justdial.com and look for card printers now.,Photos from Just Dial's post,photo,https://www.facebook.com/JustDial/photos/a.218451745268.178591.210623000268/10153104306750269/?type=3,2015-03-21 04:30:00,236,14,3,236,0,0,0,0,0
210623000268_10153106049895269,Happy Gudi Padwa!,Timeline Photos,photo,https://www.facebook.com/JustDial/photos/a.218451745268.178591.210623000268/10153104529815269/?type=3,2015-03-20 23:30:00,48,5,2,48,0,0,0,0,0
210623000268_10153100131520269,For all the foodies out there. How about these cushions in your bedroom? Visit www.justdial.com and look for home decor stores.,Photos from Just Dial's post,photo,https://www.facebook.com/JustDial/photos/a.218451745268.178591.210623000268/10153100130835269/?type=3,2015-03-18 08:23:08,863,14,26,863,0,0,0,0,0
210623000268_10153097807545269,Explore the new services of Justdial- The Search Plus Engine!,Just Dial's cover photo,photo,https://www.facebook.com/JustDial/photos/a.10150765605555269.469341.210623000268/10152442373565269/?type=3,2015-03-17 07:33:45,678,45,37,678,0,0,0,0,0
210623000268_10153097624205269,"50 million+ user ratings & still counting!
A BIG THANK YOU to all Justdial users for your love & support :)",Timeline Photos,photo,https://www.facebook.com/JustDial/photos/a.218451745268.178591.210623000268/10153097569980269/?type=3,2015-03-17 05:30:00,385,9,22,385,0,0,0,0,0
210623000268_10153095433305269,Time for some refreshing slush at home to beat the summer heat. Visit www.justdial.com and look for electronic shops near you to find some good slush makers.,Photos from Just Dial's post,photo,https://www.facebook.com/JustDial/photos/a.218451745268.178591.210623000268/10153095432685269/?type=3,2015-03-17 00:45:00,1137,15,56,1137,0,0,0,0,0
210623000268_10153095606935269,"To all those who love their childhood, end your boring Monday on a nostalgic note. Visit www.justdial.com and look for cake shops near you.",Photos from Just Dial's post,photo,https://www.facebook.com/JustDial/photos/a.218451745268.178591.210623000268/10153095606000269/?type=3,2015-03-16 09:21:32,492,16,17,492,0,0,0,0,0
210623000268_10153088196450269,Water is good for your body. Drink it in an unusual and fun way. Visit www.justdial.com and look for supermarkets near you.,Photos from Just Dial's post,photo,https://www.facebook.com/JustDial/photos/a.218451745268.178591.210623000268/10153088196015269/?type=3,2015-03-14 04:53:01,458,10,15,458,0,0,0,0,0
210623000268_10153090228810269,"HURRY!! 6 hours to go, last few tickets left. Here's you chance to watch Arijit Singh perform ""Tum Hi Ho"" LIVE TODAY at Phoenix Market City Mall, #Bangalore
Book tickets now @ http://bit.ly/arijit_bglr",Arijit Singh Live in Concert Bangalore | Justdial Events,link,http://bit.ly/arijit_bglr,2015-03-14 00:44:24,189,6,3,189,0,0,0,0,0
210623000268_10153087794980269,Surprise your mom with something beautiful to eat.Visit www.justdial.com and order fruits online.,Photos from Just Dial's post,photo,https://www.facebook.com/JustDial/photos/a.218451745268.178591.210623000268/10153087794655269/?type=3,2015-03-13 00:53:42,1196,14,97,1196,0,0,0,0,0
210623000268_10153085440520269,"A stroll to a nearby ice-cream shop can be refreshing in this hot climate. Visit www.justdial.com and look for near-by 
ice-cream parlours now.",Photos from Just Dial's post,photo,https://www.facebook.com/JustDial/photos/a.218451745268.178591.210623000268/10153085440215269/?type=3,2015-03-12 01:32:58,2014,31,76,2014,0,0,0,0,0
210623000268_10153083573795269,Block your dates. Your favourite singer is here to make you fall in love all over again! Book here: http://bit.ly/arijit_bglr,Timeline Photos,photo,https://www.facebook.com/JustDial/photos/a.218451745268.178591.210623000268/10153083556140269/?type=3,2015-03-11 09:19:09,25,2,2,25,0,0,0,0,0
210623000268_10153082749850269,Time to go a bit off- beat. Buy some unusual computer accessories for your PC. Visit www.justdial.com and look for electronic stores near you.,Photos from Just Dial's post,photo,https://www.facebook.com/JustDial/photos/a.218451745268.178591.210623000268/10153082749690269/?type=3,2015-03-11 00:49:59,192,6,8,192,0,0,0,0,0
210623000268_10153078562510269,Begin this week on a lighter note..Keep Smiling :),Timeline Photos,photo,https://www.facebook.com/JustDial/photos/a.218451745268.178591.210623000268/10153076065475269/?type=3,2015-03-09 02:02:30,80,8,2,80,0,0,0,0,0
210623000268_10153075948960269,"Happy Women's Day 
Cheers to all the ladies out there.",Timeline Photos,photo,https://www.facebook.com/JustDial/photos/a.218451745268.178591.210623000268/10153069537025269/?type=3,2015-03-08 00:30:01,1143,10,98,1143,0,0,0,0,0
210623000268_10153066810170269,After the harsh Holi colours your skin needs some good therapy. Visit www.justdial.com and look for beauty salons now.,Photos from Just Dial's post,photo,https://www.facebook.com/JustDial/photos/a.218451745268.178591.210623000268/10153066809990269/?type=3,2015-03-07 00:00:00,309,6,7,309,0,0,0,0,0
210623000268_10153071122110269,Let there be colors all around :),Timeline Photos,photo,https://www.facebook.com/JustDial/photos/a.218451745268.178591.210623000268/10153071121205269/?type=3,2015-03-06 02:37:33,1233,25,48,1233,0,0,0,0,0
210623000268_10153066778355269,Go green. Use organic colours this Holi. Visit www.justdial.com and look for departmental stores near you.,Photos from Just Dial's post,photo,https://www.facebook.com/JustDial/photos/a.218451745268.178591.210623000268/10153066776270269/?type=3,2015-03-05 00:03:01,1032,14,148,1032,0,0,0,0,0
210623000268_10153066803250269,It is celebration time. Have you decided on which sweet to order this Holi?,Timeline Photos,photo,https://www.facebook.com/JustDial/photos/a.218451745268.178591.210623000268/10153066775445269/?type=3,2015-03-04 05:00:01,538,16,30,538,0,0,0,0,0
210623000268_10153054909515269,"All the cake lovers, you have got valid reason to take a break from your boring diet. Visit www.justdial.com to know the nearest cake shops and order a fruit cake now.",Photos from Just Dial's post,photo,https://www.facebook.com/JustDial/photos/a.218451745268.178591.210623000268/10153054908680269/?type=3,2015-03-02 00:04:00,1940,33,66,1940,0,0,0,0,0
210623000268_10153054907890269,Take good care of your pets. After all they are part of the family. Visit www.justdial.com and look for pet shops around.,Photos from Just Dial's post,photo,https://www.facebook.com/JustDial/photos/a.218451745268.178591.210623000268/10153054905710269/?type=3,2015-02-28 23:40:00,1882,28,106,1882,0,0,0,0,0
210623000268_10153056209350269,Saturday night calls for some chilling scenes. Visit www.justdial.com and look for some good lounges in your locality.,Photos from Just Dial's post,photo,https://www.facebook.com/JustDial/photos/a.218451745268.178591.210623000268/10153056209130269/?type=3,2015-02-28 00:01:00,148,11,2,148,0,0,0,0,0
210623000268_10153054892645269,Give a girl the right shoe and she will conquer the world. Visit www.justdial.com and look for shoe shops near you.,Photos from Just Dial's post,photo,https://www.facebook.com/JustDial/photos/a.218451745268.178591.210623000268/10153054891995269/?type=3,2015-02-26 23:35:00,666,18,30,666,0,0,0,0,0
210623000268_10153048169910269,Capture the beauty of nature in your own style. Visit www.justdial.com and look for good deals on cameras.,Photos from Just Dial's post,photo,https://www.facebook.com/JustDial/photos/a.218451745268.178591.210623000268/10153048169110269/?type=3,2015-02-26 00:20:01,299,6,12,299,0,0,0,0,0
210623000268_10153048167310269,Pamper yourself. Visit www.justdial.com & look for some amazing spas near you.,Photos from Just Dial's post,photo,https://www.facebook.com/JustDial/photos/a.218451745268.178591.210623000268/10153048166765269/?type=3,2015-02-24 23:50:00,393,6,11,393,0,0,0,0,0
210623000268_10153050266425269,What is your pick of the day? Visit www.justdial.com and look for coffee shops near you.,Timeline Photos,photo,https://www.facebook.com/JustDial/photos/a.218451745268.178591.210623000268/10153048167780269/?type=3,2015-02-24 05:50:00,61,1,8,61,0,0,0,0,0
210623000268_10153048166420269,Isn't this a really nice gift for that special person? Visit http://bit.ly/JDflowers & order flowers now.,Photos from Just Dial's post,photo,https://www.facebook.com/JustDial/photos/a.218451745268.178591.210623000268/10153048165555269/?type=3,2015-02-23 04:38:27,396,1,10,396,0,0,0,0,0
210623000268_10153045835665269,You do not need to give a reason for laundry delays. Visit www.justdial.com and look for laundry service provider.,Timeline Photos,photo,https://www.facebook.com/JustDial/photos/a.218451745268.178591.210623000268/10153039999185269/?type=3,2015-02-22 05:30:01,117,2,7,117,0,0,0,0,0
210623000268_10153039996915269,Carry your phone with style. Visit www.justdial.com and look for mobile stores near you.,Photos from Just Dial's post,photo,https://www.facebook.com/JustDial/photos/a.218451745268.178591.210623000268/10153039993980269/?type=3,2015-02-21 00:30:01,331,5,17,331,0,0,0,0,0
210623000268_10153040076890269,"Handbags are like friends, you can never have too many of them. Visit www.justdial.com and look for bags stores near you.",Timeline Photos,photo,https://www.facebook.com/JustDial/photos/a.218451745268.178591.210623000268/10153039993325269/?type=3,2015-02-20 01:55:16,534,9,30,534,0,0,0,0,0
210623000268_10153035277595269,Some clever advertising can help your business come a long way. Visit www.justdial.com and look for the advertising agencies in town.,Photos from Just Dial's post,photo,https://www.facebook.com/JustDial/photos/a.218451745268.178591.210623000268/10153035276220269/?type=3,2015-02-19 01:00:00,125,3,8,125,0,0,0,0,0
210623000268_10153032672405269,It's all about thinking creatively. Visit www.justdial.com and look for some hobby classes for yourself.,Photos from Just Dial's post,photo,https://www.facebook.com/JustDial/photos/a.218451745268.178591.210623000268/10153032671515269/?type=3,2015-02-18 06:00:00,952,23,138,952,0,0,0,0,0
210623000268_10153032670055269,Fruits are good for health. Keep your kitchen stocked up with them. Visit www.justdial.com and order grocery online.,Photos from Just Dial's post,photo,https://www.facebook.com/JustDial/photos/a.218451745268.178591.210623000268/10153032669910269/?type=3,2015-02-17 02:09:23,1287,15,98,1287,0,0,0,0,0
210623000268_10153022239520269,Transferring data was never so much fun. Visit www.justdial.com & look for some cool gadgets.,Photos from Just Dial's post,photo,https://www.facebook.com/JustDial/photos/a.218451745268.178591.210623000268/10153022238840269/?type=3,2015-02-15 23:40:00,255,5,14,255,0,0,0,0,0
210623000268_10153024164830269,Happy Valentine's Day,Timeline Photos,photo,https://www.facebook.com/JustDial/photos/a.218451745268.178591.210623000268/10153024164735269/?type=3,2015-02-14 01:22:50,672,23,25,672,0,0,0,0,0
210623000268_10153022268460269,Visit your favourite restaurant & relive all the moments you have shared with your loved one. Visit www.justdial.com and book a table now.,Timeline Photos,photo,https://www.facebook.com/JustDial/photos/a.218451745268.178591.210623000268/10153022112085269/?type=3,2015-02-13 08:00:01,375,4,24,375,0,0,0,0,0
210623000268_10153021668690269,"Bring a smile on your loved one's face with a cute little card!
Visit www.justdial.com to locate the nearest gift shop to grab one.
#CelebrateLove",Photos from Just Dial's post,photo,https://www.facebook.com/JustDial/photos/a.218451745268.178591.210623000268/10153021667110269/?type=3,2015-02-13 00:18:30,84,2,1,84,0,0,0,0,0
210623000268_10153019838640269,"A romantic Bollywood movie with your beloved is one up to all your Valentine's Day idea.
Share with us your favourite Love Story :)
#CelebrateLove",Timeline Photos,photo,https://www.facebook.com/JustDial/photos/a.218451745268.178591.210623000268/10153019836595269/?type=3,2015-02-12 04:45:05,235,7,9,235,0,0,0,0,0
